title,score,text,url
Pink Blossom set + Utility Yellow full zip 💗💛 Still in my love month era so we’re calling this Pink Lemonade energy 🍋💕,68,"Pink blossoms: 

FTBS(8)

Align HR 25”(4)

Utility Yellow:

Os Full zip hoodie (Xs/S)",https://www.reddit.com/gallery/1rc6up1
Burgundy Bay cropped define,62,Literally in love with this color and the no line wundertrains. Also wearing the like a cloud longline bra in pink pearl. Weekend shopping trip was a success ☺️,https://i.redd.it/plj94gxqu5lg1.jpeg
Shopping/Sizing Advice Questions,1,"Hey everyone,

My fiancée's birthday is coming up and I want to get her a few things from Lululemon.  This will also be from the Canadian store not the US store. 

I just have a few questions about sizes.

She's gotten into Pilates and aerial yoga over the last few years so ideally  whatever I pick could be worn both casually and in class.

For reference she is 5'6 and about 135 pounds. She has narrow shoulders and wider hips and thicker thighs.  

Her bra size is 32DD.  She used to wear size 4 but the most recent define jacket she got was a size 6 because a size 4 would not zip over her chest.  I'm not sure if that means she's a 4 or 6 in tops, I think I might lean towards a 4 still as long as there is no zipper.

Are there any tank tops with the built in bras for that size, or do I need to just buy a straight up sports bra? During my brief research I've only seen sports bras in this size, no tank tops.  When we go for walks around the neighborhood she would almost certainly rather wear a tank top than a sports bra.   

As for pants, she wears a size 4 for leggings and she usually gets the 28 inch inseam, but it does bunch up a bit at her ankles.  She has said that she wants a pair of the flared leggings, but she doesn't want to step on the material at the bottom as she walks.  Problem is all I've seen are the inseams starting at 30 inches, which will certainly be too long.  Do they have the flared leggings in shorter inseams or do I just go for regular leggings instead then?

Personally I'm a fan of the tennis skirt look, she has one from Artizia that she likes. Are the tennis skirts from here of similar quality vs artizia's?

And lastly, what colours are fun/trendy right now?  She tends to wear a lot of neutrals but always complains about not being colourful enough lol. She will not wear prints, it'll have to be colours only.  

I typed this out quickly so please let me know if there are any follow up questions or if anything needs to be clarified.

I apologize for the wall of text and thank you all for your help!

",https://www.reddit.com/r/lululemon/comments/1rc5cgd/shoppingsizing_advice_questions/
ISO Luxtreme Type Pant,2,"Luxtreme has been my go to fabric for years and I feel like lulu hasn’t been using it as often anymore! It’s stretchy, comfortable, dog hair doesn’t stick, looks more elevated. It’s SO good 

I have the day drift pant but does anyone have any recommendations for pants (even from other brands!) that are similar in fabric?! 

Give me all the recommendations! ",https://www.reddit.com/r/lululemon/comments/1rc1sa9/iso_luxtreme_type_pant/
Sinatra blue,127,I can’t get over this in store find! 28” Sinatra blue wunder trains for $39. I also got them in walnut crunch for $39! ,https://i.redd.it/wjf5l17iu4lg1.jpeg
"Big dump of rockwood, black plum, grape mist, indochine blue, and probably more, on Like New",38,"I know a lot of people have had negative experiences with Like New but I’ve noticed when I buy recently released colors, like stuff that has just gone to WMTM and might still be there but out of stock in a lot of sizes, everything I’ve ordered has arrived literally “like new.” No tag, but always a rip tag still on there and folded with creases, looks like it’s never been out of the packaging. 

I don’t know if some of these are actual returns but I think a lot of it has to be coming from stores or warehouses or whatever when it goes to WMTM. Because there’s no way obviously people sold back all this indochine blue, for example, to Lululemon in the last couple weeks. It definitely hasn’t been worn. Maybe not all of it but a lot of it. Another example, the grape mist long funnel neck scuba just moved to WMTM a couple weeks ago, I had it in my cart but was just leaving it there because I don’t NEED it, well now it’s gone I assume sold out in all sizes but it just showed up on Like New. I browse fairly regularly to try to catch a good deal and there were a couple things in those colors before but today it’s a ton. Go check it out! I got define track pants in black plum, an align racerback tank in rockwood, and indochine blue dance studio pants. They‘re out of my size on WMTM but they are $77 on Like New instead of $99 on WMTM and my hypothesis is that they are the exact same pants lol so we’ll see when they get here but I think there are some good deals on there right now!",https://www.reddit.com/r/lululemon/comments/1rc0cpi/big_dump_of_rockwood_black_plum_grape_mist/
cold gym fit🩷💙,167,"flow y bra- pink frosting + align 6”- utility blue + reversible brushed cotton crossover sweater - silver drop

happy sunday! going in for some mobility work and cardio 🫶🏼",https://i.redd.it/yjxq70m2d4lg1.jpeg
Try-on,45,"Love the burgundy bay, but left with nothing in that color ☹️",https://www.reddit.com/gallery/1rbyokf
older Lulu for the win!,39,java wide leg aligns (depop find!!) and heathered Paris pink define. miss when Lulu did jackets like this! also getting rid of the wide leg aligns was crazy work bring them back!!,https://www.reddit.com/gallery/1rbwaii
"Ordered from LikeNew, received an obviously fake item 🫠 (Rant)",25,"[No reflective logo, just raised silicon emblem.](https://preview.redd.it/yejdh8lk53lg1.jpg?width=3024&amp;format=pjpg&amp;auto=webp&amp;s=ccc1c7f80fe2b3ac5acfcc454dd13af57333efe6)

[Tag is just wrong, no tearaway feature and stitching sucks.](https://preview.redd.it/hqmnq8lk53lg1.jpg?width=3024&amp;format=pjpg&amp;auto=webp&amp;s=5ea1fba9a4a205cc7da1669dbe3ec5d11ee6887a)

[Material is AWFUL. Not butter-soft, just itchy.](https://preview.redd.it/n05zj8lk53lg1.jpg?width=3024&amp;format=pjpg&amp;auto=webp&amp;s=51f9ec78b8f4f89256aab86854144182ac21268d)

[No size dot in pocket.](https://preview.redd.it/awl9o9lk53lg1.jpg?width=3024&amp;format=pjpg&amp;auto=webp&amp;s=0df9baab0bcb2dfaa4a51dfcdacf4bc323842e26)

Not going to lie, most of my items are purchased from the LikeNew website or from the outlet location near my hometown. Especially if those items are still on the original website, I know I can save a little bit of money. That being said, I ordered a black define jacket from LikeNew because I wanted a simple color compared to the other ones I have. I received it today and knew immediately after taking it out of the package that it wasn't a real item. Every time I look at it, I find something else wrong. I'll let the pictures speak for themselves, but I'm very disappointed. I'm not sure how something like this could be missed. I reached out to customer support and of course since it's a Sunday, I'll have to wait to hear back. Just a little bummed because I had been looking forward to this package all week and was let down. 

Has anyone else had a similar experience with LikeNew? How was it resolved?

",https://www.reddit.com/r/lululemon/comments/1rbstcz/ordered_from_likenew_received_an_obviously_fake/
I love shopping my closet and finding items I haven’t worn yet🤣🤣 found the Align Wordmark leggings in color Rockwood (6),95,Rockwood Cropped define (8) Wordmark aligns (6) Sheer Oak daily essentials socks ,https://i.redd.it/upbe385dw2lg1.jpeg
Which one should I go for,3,Paramedic student. Wearing it during practicals at school mostly (cold climate),https://i.redd.it/wfu91e07m2lg1.jpeg
Capri in Morning Light 💙,149,"When the sunlight hits, capri really pops! Still one of my favorite blues from Lulu.

Wearing:

• Unrestricted Tee (L) in black

• Wunder Train 31” (10) in capri

Hope everyone’s having a slow, relaxing Sunday!",https://i.redd.it/mpqx8alwk2lg1.jpeg
Rainforest Green Set,28,Oversized Scuba Joggers and Oversized Full Zip Scuba Hoodie in Rain Forest Green,https://i.redd.it/30hxit8gj2lg1.jpeg
Grape Mist 🍇 ☁️,131,"Finally able to wear my black wrap out for pilates!

WT HR Grape Mist  size 6
Energy Longline Bra Grape Mist size 8
Nulu Ribbed Wrap Front Blacl Size Small",https://www.reddit.com/gallery/1rboosq
Has anyone else gone to the Lululemon Gym Yet?,151,Wearing my polka dot flocked set 😊,https://www.reddit.com/gallery/1rbom9s
What’s the warmest men’s hoodie?,0,Want something that I can lounge in and run errands in. Any recs?,https://www.reddit.com/r/lululemon/comments/1rbnjbk/whats_the_warmest_mens_hoodie/
"Found this unique piece , anyone else have this?",52,,https://www.reddit.com/gallery/1rbmfq3
Please help! What is happening with my wunder train strappy tank?,0,"I bought this about 2.5 years ago, I started noticing the edges rolling like this only after several months, but it's since progressively gotten worse over the years. I own several other Lululemon items (including the envital, wunder train bra, flow y, and removable tube top) and have never experienced this kind of issue with any of them. 

https://preview.redd.it/4bg0lwtni1lg1.jpg?width=1152&amp;format=pjpg&amp;auto=webp&amp;s=8e4ada7febb39ddfdc47dd3fcf95b6d601bd91e9

I've already reached out to CS but they said they can't do anything because the quality promise is only valid for one year. Is there anyway I can fix it and stop it from happening again?",https://www.reddit.com/r/lululemon/comments/1rbkq6i/please_help_what_is_happening_with_my_wunder/
Sunday Wardrobe Reset,54,"Anytime that I’m in the city, I get a chance to reset my wardrobe. I did a lot of laundry yesterday &amp; put away it all this morning — I mainly hand wash items with doing a wash in the washer for whatever else needed! I love seeing the defines so organized!!! Happy Sunday folks! ",https://i.redd.it/yvk5rrj3i1lg1.jpeg
Sunday Rave Thread,1,"Finally found a restock on something you’ve been waiting for? Had an awesome experience in store? Tried out a new piece and you’re loving it? Let’s hear it!

This is the place for all the good things! Looking to vent instead? Check out Saturday’s rant thread.",https://www.reddit.com/r/lululemon/comments/1rbi1sy/sunday_rave_thread/
Some must have,0,"I am new to buying Lululemon. However what are some staples I should have? I have 4 pair of leggings, 2 shirts, 3 pair of pants, 1 full length defined, and 2 cropped defined. Almost all of them are black. What are some colors I could add. I am a dark autumn as well. ",https://www.reddit.com/r/lululemon/comments/1rbbbr0/some_must_have/
Dramatic Magenta 💟Lettuce edge quarter socks,87,My lettuce edge socks came in and I really love how it brings a girlie little detail 💟🖤,https://www.reddit.com/gallery/1rbba60
Glow Up Tank Top,146,"Okay why am I just now realizing that I love this tank top because now I genuinely want it in every single color!!

I’m a 32D and normal align tanks don’t work for me. They’re uncomfortable in multiple ways and I always feel like I’m adjusting something. 

This tank on the other hand keeps everything in, I haven’t had to adjust the straps at all, there’s zero armpit “squeezage”, and I was able to wear it to a kids birthday party without feeling like a super self conscious mom 😂 I usually wear a size 6 in all Lulu tops and bras but actually found that a 4 fits better in this specific style. The 6 was overall too loose. 

Wearing:

\- Glow Up Tank Atmospheric Purple - size 4

\- Align Leggings Atmospheric Purple - size 2",https://i.redd.it/2civgli6oxkg1.jpeg
AN OXFORD RED PILATES OOTD: DEFINE JACKET NULU W 25” ALIGNS ♥️,87,"I’ve been enjoying wearing lots of red this month of february.♥️ 

i own 2 pieces in dark red. oxford red is a more vibrant warmer red. dark red is a classic richer red that is much less bright. ",https://i.redd.it/y917nflckxkg1.jpeg
Does anyone have these pants in this color? I need to compare a detail before I burn my house down!,0,"I noticed these spots on the inside waist band and though they match the color of the pattern, they look suspiciously out of place.  
So I'm freaking out bc if it's not ink from the pants then it could mean having to bomb my house with pest control 😳.

If you have these pants, please send me a pic of the inside waist for comparison !!!!


",https://www.reddit.com/gallery/1rb5ad7
Pink color comparison,3,"Does anyone have a comparison of candy cloud and pink tide, in my head they seem like they’d be very close match but I’ve never seen candy cloud in person. ",https://www.reddit.com/r/lululemon/comments/1rb4bmu/pink_color_comparison/
Like New - Excellent 🤡,10,"Just purchased a Like New – Excellent item from likenew.lululemon. Horrible experience—one of the pants that was supposed to be in excellent condition came with a huge hole.

Beware, everyone! Make sure to double-check your items. Very frustrating. 😤",https://www.reddit.com/gallery/1rb3n16
New Lulu Sweater,43,Scuba Oversized Funnel-Neck Half Zip (Long) in Grape Mist/ Silver with Glow Up Super-High-Rise Tight in True Navy,https://i.redd.it/eqxvfoy02xkg1.jpeg
What is the blue long sleeves shirt underneath? Please help. Google is not helpful,7,Looks like swiftly but I couldn’t find it  in the app,https://i.redd.it/zx2g4teb1xkg1.jpeg
couple fits from this week!,58,Working in medicine is not for the weak. I stayed late so many times this week and had to miss multiple classes (and am prolly gonna have to deal with the cancellation fee…which is fair; it just sucks). There’s been a lot of emergencies and I’m some where new temporarily so setting boundaries is hard. Working out is the one thing that helps me regulate and not burn out so I was bummed at how many times I missed the gym this week…but here’s my fit from today and wed day! WT are raspberry coulis and define jacket is the black and gold. Second for is rainforest green aligns. I did stop by a store and picked up some blush quartz shorts…so I might post a for pic w that next week 👀,https://www.reddit.com/gallery/1rb1o0w
Fits for the week🏋️‍♂️,47,"Happy Saturday everyone! Hope your weekend is off to a good start! Decided to throw some of my fits from the week into this post again. My favorite combo was the last one 😊 

1st - License To Train Short Sleeve in Black

Pace Breaker  Short 5” \*Iridescent in Cornflower/Red Clay

2nd - Repper Sleeveless Tank Top in Steel Blue

Pace Breaker Reflective Knit Short  7” White/Black

3rd - License to Train Tank in Black

Ventilated Tennis Short 7” Animal Mesh Lulu Red Multi

4th - License to Train Short Sleeve in Briar Rose/White

License to Train Linerless Short 5” in Sea Water",https://www.reddit.com/gallery/1ray8xc
Left: Rainforest green WT Right: Walnut crunch WT,23,"I was super worried about the infamous green tone showing on walnut crunch but I was so relieved to see that it still feels brown! I get that in certain lighting it looks brighter and has the golden or green tones to it but I don’t mind it at all because it pairs so well with my ivory scuba!!! if anything I like its magical quality of shifting colors lol

\*\*Sorry it's not a direct browns color comparison since I only have the green! Also just wanted to get across the point that it still feels brown as long as you don't mind that it's less warm in certain lighting!",https://i.redd.it/bfmnn0161wkg1.jpeg
For the love of Studio Pants (and ?),0,"Quick question from a newb: 

I freaking love the studio pants - but the pair I bought last year and the year before are not lined.  I ordered a new pair this year and they are lined.  

(Middle waisted version with the ties at the bottom - not the joggers or cargos) 

Are they all lined now? Chat GPT tells me they went from unlined to lined because at first they were meant to go over leggings and now they are just pants. 

I don’t mind, I love the lined ones in winter but the unlined ones are so breezy.  I’m just trying to understand what versions/options we have now. I hope they never stop making these. 

I did search and I see conflicting info - some posts say there’s an older version where they are all lined and the newer version I have now are lined simply because their color. True? ",https://www.reddit.com/r/lululemon/comments/1rav5c8/for_the_love_of_studio_pants_and/
Just put together two things in my closet,65,"Honestly trying to wear what I have rather than keep buying but there are some cutie new items! Totally forgot I had these two pieces that match! Going to grab coffee ☕️ 

Bottoms // Court Rival Wide Leg Track Pant \*tall // club blue // size 10

Top // Wunder train racer back // Club Blue // size 10 ",https://i.redd.it/buw9vf3dbvkg1.jpeg
Saturday Rant and Unpopular Opinion Thread,1,"Don’t see you size in stock? The color you want hasn’t dropped? Package got lost or is taking forever to ship? Product not performing well? Can’t get through to GEC? This is the place to share your weekly Lululemon woes!

Please keep the rules (in particular, rules 1 and 3) and general reddiquette in mind when posting. This isn’t a spot to call out or harass specific users of this sub! 

Keep an eye out for a Sunday Raves thread tomorrow to share your good news for the week, too!",https://www.reddit.com/r/lululemon/comments/1ranfi1/saturday_rant_and_unpopular_opinion_thread/
Shipping from US to europe now possible?,0,"https://preview.redd.it/iqqwf5zfrskg1.png?width=2568&amp;format=png&amp;auto=webp&amp;s=823a6e72934656002dde9e0892c62ac2eff3ca61

I know that it was not possbile but regarding to their homepage it is now? ",https://www.reddit.com/r/lululemon/comments/1rakkgm/shipping_from_us_to_europe_now_possible/
Forest fit for forest yoga!,193,"Flow Y Bra Nulu, Heathered Willow Leaf, M

Wunder Train High-Rise Tight 25, Willow Leaf

",https://www.reddit.com/gallery/1raf966
Old school Groove pants,27,"I scored these off Ebay sometime ago and it has that ""I belong to"" label ",https://www.reddit.com/gallery/1radq2y
What to buy,3,"So I got a LL gift card. Never bought from there before. Looking for recommendations for the following:

1. Shorts (at least 4”, compressive, high waisted) 

2. Full length leggings (maybe ones that hit at the ankle for a 5’6” girl, high waisted, also compressive) 

Pockets are a must. I’m a girl. Size 8-10ish. All my other running shorts are CVG or Baleaf. 

Give me your suggestions. Please. ",https://www.reddit.com/r/lululemon/comments/1raclcn/what_to_buy/
Minnie Mouse vibes with Oxford red ❤️🖤,30,"Love the Oxford red wunder trains with black. It’s one of my fav combos. 

I got the wrap top with the heart on the sleeve and the black ebb to street tank for valentines. 

Such a fun outfit. Even at 56 we need cute stuff ❤️

Oxford red wunder trains 28 inch size 8

Nulu ribbed wrap long sleeve with heart size L

Ebb to street tank size 12 in black 

Down 78 pounds officially this week - just a few more and I’ll be in onederland! 

The Lulu fit keeps me motivated 

Have a beautiful Friday ❤️❤️",https://www.reddit.com/gallery/1ra97t8
"Lulu released my fav swiftly of all time, ordered immediately, package was lost, item was sold out, was refunded and then it showed up at my doorstep😭😭",264,And they’re letting me keep it!,https://www.reddit.com/gallery/1ra97q6
Deep Marina / gold zip define jacket,119,"This seems to look way lighter online . I know that's an issue with lulu but I'm disappointed. I thought it was going to be more Maldives green tone just darker but it's more storm teal . 

Here it is with my storm teal define . ",https://www.reddit.com/gallery/1ra8kxk
OOTD🤎🐻,46,It's rulu half zip in walnut crunch with espresso aligns 😍,https://i.redd.it/nbg4qsq8rpkg1.jpeg
"Scuba Mid-Rise Wide-Leg Waffle,Warm Ash Gray",21,"Scuba Mid-Rise Wide-Leg Waffle,Warm Ash Gray available in all sizes on Canada site!  Im So happy I missed the first release.  Now will have a set! ",https://www.reddit.com/gallery/1ra4ul9
My new cutie 🍋🥹,138,"Just wanted to share an initial review of this bag (along with my kind of boring ootd).

It came meticulously wrapped, no damage or scratches anywhere.

I love the size. Not overwhelming even on a shorter frame. Inside there's a zipper pouch on one side, and an open pouch on the other. It's overall spacious and can definitely fit the essentials and more. The little lemon is removable of course. I think it's cute, but obviously nice to have the option to wear without too.

The colors (especially the handles, piping, zipper pulls) are nicer in person than they look in the website photos.

It looks well made. No shitty stitching or loose strings or anything. Well functioning zippers. Only time will tell how it holds up after regular use. I'm hoping that with proper care it will last a while!

I'm wearing softreme cinch waist jacket in bone

Soft jersey 7/8 midrise jogger

Bowler crossbody bag 4.5L

",https://www.reddit.com/gallery/1ra3rmm
New color dusk? What do you guys think about this color?,24,"Im on a fence 🙈 looks like it would be beautiful for soft autumn, buut maybe hard to style? ",https://i.redd.it/1oju0nck2pkg1.jpeg
Atmospheric purple 💫,190,"Atmospheric Purple Align legging no line 28"", Wunser Train Jacket, Flow Y bra underneath

I love this color!!",https://i.redd.it/n1edcv0h2pkg1.jpeg
super high rise,0,"I love the ultra high-rise elations from Athleta. I also have Align. I usually get the 25 inch since I’m 5’5. They have the 28 inch on sale. Worth trying or do you think too long? TIA. 
I can’t find 25inch on Poshmark. ",https://www.reddit.com/r/lululemon/comments/1ra2udd/super_high_rise/
Leg days are my favorites 🦵🏻🏋🏻‍♂️,55,"Wearing Base Pace High-Rise Running Tight 25"" in Sparks Fly Multi 🎇 and Athleta Transcend Thin Strap Crop Bra in Black. 🖤",https://www.reddit.com/gallery/1ra29pm
"Loving this earthy combination! Flow Y bra Graphite Gray (6), Align 6” shorts Nomad (6)",43,Got the bra and shorts brand new with tags off Curtsy and Mercari!,https://i.redd.it/jjflpap8hokg1.jpeg
Ebb to street Crop vs full,21,Is the crop cut different or does it run smaller ??? I feel like i’m busting out of the cropped 6 and fit in the full size 6 - anyone try sizing up in the cropped version and find it better ??,https://www.reddit.com/gallery/1r9zigq
Align Scoop waist-length tank sizing help,1,Been eyeing this tank in Oxford Red.  I wear 8 or 10 in Align tank top (depending on my cycle) and 6 in align waist-length racerback.  Which would you recommend off my sizes? ,https://www.reddit.com/r/lululemon/comments/1r9yzuj/align_scoop_waistlength_tank_sizing_help/
Thrift store legging finds are my fav 😏💗,223,Mauve tie dye align leggings X align long sleeve ,https://i.redd.it/8ha639tn2okg1.jpeg
Monochromatic Friday!,57,"Everything is eucalyptus green! 

Define jacket // eucalyptus green // size L 

Align 25 // eucalyptus green // size 8",https://i.redd.it/folklukzpnkg1.jpeg
Friday Employment Thread,2,"This weekly thread is the place to get answers to all your questions about the interview process, questions commonly asked during interviews, and what it's like to be an educator. 

It's also a space for all our wonderful educators to share any inside scoops, hiring tips and tricks, and anything and everything in between! 

Happy Friday everyone! :)",https://www.reddit.com/r/lululemon/comments/1r9rdt4/friday_employment_thread/
Align bodysuit fit check!,31,"Align bodysuit 6"" in espresso! 

I was pleasantly surprised at how well this worked on my rectangular body shape! 

Also wearing the classic ball cap in light ivory, as well as Aritzia gramercy shrug in light birch and Ugg classic ultra mini platform boots in chestnut. 

If you are thinking about buying and need sizing info and my measurements just lmk but I'm not going to write that unless anyone needs it! ",https://www.reddit.com/gallery/1r9knz3
Are there any leggings that are more compressive/supportive than wunder trains?,10,"Not sure if wunder trains are the most compressive, as I haven’t bought any leggings besides those! I’m not loving them lately as they just don’t feel very supportive in my high intensity workouts. My stomach and thighs jiggling in these leggings are driving me insane, so I need something that will hold me in like I’m strapped in to fly into orbit 😀 I’m kinda in between an 8 and a 10, which is annoying too. I’ve been losing weight, but this damn stubborn stomach of mine is causing havoc for me in the workout scene, so please help a girl out. 😂🩷",https://www.reddit.com/r/lululemon/comments/1r9j7lt/are_there_any_leggings_that_are_more/
BeCalm or Scuba joggers?,1,"I want some new comfy joggers (will mostly only be worn at home) and I was going to get the scuba jogger, but then saw they have some BeCalm on MD for $54. I‘ve seen mixed reviews for the BeCalm line. If you have tried both, what do you recommend? Would love to get the Becalm for cheaper, but if scuba is a lot better then I’ll get those. TIA! ",https://www.reddit.com/r/lululemon/comments/1r9fhl9/becalm_or_scuba_joggers/
Having a last minute surgery- rate my recovery order,53,"Requesting any additional insight for the best comfy, maneuverable fits. Thanks gang!",https://i.redd.it/3qz9g8v79jkg1.png
