title,score,text,url
Tuesday Drop Discussion,28,"Hi everyone! Welcome to the official **Tuesday Drop Discussion**! Chat here about your reactions to the new drop, what you're planning on buying (or not buying...), and anything and everything in between!

————————

**Please keep all links and discussion around the new drop in the comments. Sort comments by new as the drop is happening to see any new releases.** 

————————

**Tips and Tricks:**

\- If something isn't showing up for you, search by item/color name, open the link, delete everything after product name and refresh. You may need to do this a couple of times. If that doesn't work, try clearing cache and cookies and try again.

\- Edit in cart trick: Add the item you want in any size and color to your cart, and then once it's in your cart change it to color you want.

\- Don't look at the What's New page, use the site search bar.

\- The app is laggy, use the website.

\- The new drop has generally been starting around 2:10 p.m. EST in the U.S. and just after 3 p.m. EST in Canada, but sometimes (very infrequently) it varies.

\- USA and Canada pretty much always get the same new items, just as mentioned above, Canada's drop happens around 40 minutes later, thus there's no Canada thread.

Good luck and happy shopping! 🥰",https://www.reddit.com/r/lululemon/comments/1r721nv/tuesday_drop_discussion/
A while back (about 4 weeks ago) I posted a few outfits right before my breast reduction surgery. Well… I’m officially 4 weeks post-op now 🙌,113,"Recovery hasn’t been easy, not going to lie. It’s been uncomfortable, emotional, and slower than I expected — but I’m getting there. And apparently healing + being stuck at home = way too much time on the Lululemon WMTM section 😅

So here are some new outfits with the new boobs (went from F cup to C cup 💃).

Picture 1:

• Define Jacket \*Warm in black, size 10 – thicker version of Nulu, perfect for colder climates. I really love the structure.

• Align No Line™ High-Rise Pant 25”, size 8 – super flattering and very comfy.

• On the right: Align Tank in Fog Green, size 12 – I’m still swollen, so this size fits perfectly right now.

Picture 2:

I’ve developed a serious obsession with the Scuba Long Funnel Necks.

• Warm Ash Grey, size M/L – paired with Align pants and the Daily Multi-Pocket Tote Bag 20L in Warm Ash Grey/Sequoia.

• Another Scuba in Sequoia (also M/L), styled with the black Belt Bag and Adapted State High-Rise Jogger \*Regular in Sequoia, size 8.

Slight disappointment: the Sequoia shades don’t match perfectly. The Scuba is noticeably darker than the joggers, which I didn’t expect. Still cute, but not the perfect set moment I imagined.

Picture 3:

Swift Mid-Rise Wide-Leg Pant in True Navy, size 8, paired with a loose Ella&amp;ill linen shirt. These trousers are going to be GOLD in summer — lightweight, flowy, and so flattering. I already know they’ll be on repeat once the weather warms up.

Overall though — dressing with a C cup feels so different. Everything sits better, zips easier, and just feels more balanced. Still healing, but very happy I did it ❤️",https://www.reddit.com/gallery/1r71o8w
Is there new light ivory?,3,"Does anyone have pics of these two bags side by side irl they could share?  
its the city essential 4l bag

I was thinking about getting this bag and saw they released a ""new"" light ivory color. They both have silver hardware, but the new light ivory looks like it has a grey tone... almost dingy looking? But I know lululemon colors look different in person compared to the pics on the website  
noticed they did this for the slouchy sling 6l bag too

none of the stores near me have either of them and it would be a lot to order both",https://www.reddit.com/gallery/1r6wgcf
Wishing I was back in 🇫🇷 🖤✨,62,"Today’s fit before some errands and yoga. 

28” Align Shine in French Press sz 6

Flow Y Heart Scatter Dot in black sz 10

Define jacket in Goodnight Plum sz 10",https://i.redd.it/mbn3bkxeqyjg1.jpeg
Front-wrap LS and more!,63,"After seeing so many cute reviews on this nulu ribbed wrap-front LS shirt HEART, I finally bit the bullet and bought the black (xxs) and then the Candy Cloud (xs) when it briefly came back in stock! I'm usually size 2 to 4 depending on the style, and I'm happy to say that both xxs ans xs fit well! xxs fits a bit tighter and it's shorter in torso and sleeve lengths, but because of the stretch, it's still very comfortable (see Picture 1-4). 

Picture 5: Brushed cotton reversible crossover sweater in Silver Drop (xs) - so cute and cozy! Bought this just in case the wrap-front LS don't work out (Guess I'll be keeping them all :p)

Picture 6: Define Cropped Jacket Herringbone in Heathered Deep Coal Black (4) - fits TTS and definitely feels thicker than the nulu version. Great for layering in Winter. On MD.

Picture 7: Define Mesh-Back Jacket (4) and Flow Y Bra (6) in Atmospheric Purple. Both fits TTS. Love the curved front hem on the jacket. I've been eyeing this Define Mesh-Back since it was dropped - happy to pick it up on MD! Guess ppl don't like it since all sizes and colors are still available (🇨🇦)

Lemme know if you have any questions:)",https://www.reddit.com/gallery/1r6t8pu
Raymond James stadium bag policy,0,"i’m stressing out over the bag/purse policy for bts concert in florida. i don’t know the exactly one that can hold car key, mini powerbank, some makeup and maybe some essential items. i know they only allow 4.5 x 6.5 for purse or wallet or whatever. but i could only find some that are 4.5 x 7. if you all have any recommendations please drop comment here. thank a lots!! ",https://i.redd.it/w6eam4i9gyjg1.jpeg
small haul!! grape mist I see you 👀,60,"a small haul ft my standard poodle girl who is judging me before she gets groomed! 

funny enough this was a reward for getting rid of a bunch of items that no longer fit anymore 😭

dusty lilac aligns w pockets, berry rumble aligns w pockets and grape mist aligns w pockets! I’ve also seen a lot of ppl loving the day drift trousers so I grabbed and tried that one since it was $60 which felt like a steal! i work in medicine and will (hopefully) be a resident very soon… so the trousers will be perfect for when I need business casual items. the aligns are a treat for me successfully going to the gym 22 times last month! here’s to more gym successes this month 🎉",https://i.redd.it/xbctxlapdyjg1.jpeg
Anyone Else Buy Lulu To Match Their Room? 🐱💖,3,"Pic 1:

Define Jacket, Nulu, Blissful Pink + Gold

Women's CrossCity Sneaker Faint Mauve/White/Mauve Grey

Align Highrise Leggings 25"" Vitapink

Pic 2:

Cotton Terry Tennis Half Zip, Pink Organza

Women's CrossCity Sneaker Faint Mauve/White/Mauve Grey

Align Highrise Leggings 25"" Vitapink

Align Waist-Length Racerback Tank Top, Vitapink

Featuring:

Women's Chargefeel 3

Back to Life Sport Bottle 32oz Shine

Kitty ears, not from lulu :)",https://www.reddit.com/gallery/1r6r51c
WT no line shorts sizing?,1,"Has anyone had the opportunity to try on the WT no line shorts &amp; if so, any insights on sizing? I previously wore a 6 in WTs but the no line leggings i wear a 4 which has me between a 4-6 on the no line shorts. I know the version with the line is notorious for sausage thighs though so i'm wondering if that's the same for the no lines or not!",https://www.reddit.com/r/lululemon/comments/1r6r2o3/wt_no_line_shorts_sizing/
A TWILIGHT ROSE 🌹 OUTFIT OF THE DAY: 25” ALIGNS W THE BRUSHED SOFTSTREME 1/2 ZIP,320,,https://i.redd.it/7yj7gn9r2yjg1.jpeg
Stormy Day Fit,27,A Stormy Day Fit with the “Skinny” not slim 5 pocket and new Onyx Grey Steady State hoody…. It’s grey and rainy out so figured I match the weather. ,https://i.redd.it/olbg4q18zxjg1.jpeg
Ebb to street tank + Align tank try on,55,"Repost ! Not sure why my previous post was deleted 😛😛

Treated myself to some Lulu for Valentine’s Day! Ebb to street tank in size 4 and align tank in size 2.

Love both.. so far prefer the align. ",https://www.reddit.com/gallery/1r6orek
Help with Similar to License to Train tanks.,0,"What is the material called for the LTR tight fit tanks?

The material feels softer and appears more sheer than a regular Swiftly. I’m looking to see what other long sleeve and sleeveless tops come in this fabric.

Super bummed they stopped making the tanks :(

Thanks for the help!",https://www.reddit.com/r/lululemon/comments/1r6ojim/help_with_similar_to_license_to_train_tanks/
Lululemon V day Goals in Flocked !,36,Meeting my goals in Flocked dots ,https://i.redd.it/vmk4aktwoxjg1.jpeg
Mod Update: How We're Handling NSFW Profiles and Monetized Links Going Forward,406,"# TL;DR We will be banning all accounts that actively participate in NSFW subreddits (content creators and active users) and/or users who maintain monetized links on their profiles (NSFW or not) after February 23rd. 

# Accounts who fit these parameters have until February 23rd to either create a new, SFW account and/or remove links from their bio and NSFW content from their profile.

\-------------------------------------------------------------------------------

There has been a huge amount of discourse about the decision we made yesterday and want to be transparent about how we came to that decision. 

As anyone who has posted a fit pic in this sub (or honestly anywhere publicly on the internet) knows, this opens the door for creeps and has been something we’ve been battling with how to deal with as a mod team for years. While we previously had the stance that as the content you post here is SFW we don’t care what you do elsewhere on the internet, this has been a gray area for us to moderate because it is impossible to tell one's intentions. Is the woman posting a photo of herself in a sports bra with cleavage showing trying to promote her OF, or is she just trying to show the fit of the bra on a larger chest size? Is someone with a Throne link in their bio only posting photos in our sub to drive traffic to their bio and make money, or do they truly want to educate sub members with their fit pics and reviews? 

With that being said, it has always been against our rules to use our sub for financial gain, including something as innocent as posting an affiliate link. Last night we received credible evidence of multiple users who were active in our sub that were trying to sell additional content through their DMs. Keeping our rule of “no using our sub for monetary gain” in mind, we permanently banned these users that were reported, made that community post, and went to bed.

We hear you that it was not fair to only ban the users who were reported and how that can seem like a personal vendetta. We should have taken the time to consider that many other users that were not directly reported to us have done the same and we should have made our stance clear on how we are going to handle NSFW profiles/monetized links going forward before taking action on anyone.

**Moving forward, we will be banning all accounts that actively participate in NSFW subreddits (content creators and active users) and/or users who maintain monetized links on their profiles (NSFW or not).** 

If your account falls under these guidelines, you will have until the 23rd to update your profile or create a new profile.

* If you are a NSFW user, you can either create a new, separate account that that is SFW or delete all previous NSFW content.
* If you are a user that has monetized links, these must be removed from your profile or you can create a new, separate account with no links.
* Users who have NSFW toggled on but are not actively participating as content creators, soliciting, or promoting monetized material will not be affected. 

After the 23rd, any accounts that do not meet these standards will be banned. Additionally, if we receive proof that you have been soliciting during your participation in this subreddit, your account will be banned immediately.

We also ask members of this community to help us enforce these standards. If you come across an account that falls under these circumstances after the 23rd, please report it to the team. As always, each report and profile will be assessed carefully and fairly before any action is taken.

Thank you for hearing us out and for helping us maintain the safety of this community.",https://www.reddit.com/r/lululemon/comments/1r6o3be/mod_update_how_were_handling_nsfw_profiles_and/
My LuluLemon water bottle stinks!,0,"My water bottle smells so bad and I dont know how to get rid of the smell. I wash it after use, clean the straw/lid with a straw cleaner and it still smells so bad :( ",https://www.reddit.com/r/lululemon/comments/1r6ly7v/my_lululemon_water_bottle_stinks/
Guy shamed by family for wearing Aligns,113,"I really think aligns are the most comfortable pants someone could own and I like wearing them with different outfits in cooler weather. Recently I got shamed by my own family and their friends for wearing them in public. They said it looks odd and gay, and to not wear them when out with them.

It hit deep.",https://i.redd.it/qomp0h9j3xjg1.jpeg
Happy Lunar New Year,266,"Define cropped jacket in Burgundy Bay
Define cropped jacket LNY in dark red (2025)
Scuba long in Burgundy Bay
",https://www.reddit.com/gallery/1r6kzhn
Contour fit sizing help,6,"Do you get your usual size Wunder train size or do you size up or down in them? My Wunder trains I have to pull a lot of string in the waist band to get them to fit snuggly around my waist, I’d prefer to not have to do that.",https://www.reddit.com/r/lululemon/comments/1r6fb2x/contour_fit_sizing_help/
Seawheeze pre and post race events??,9,"https://preview.redd.it/i6l1unzpmvjg1.png?width=698&amp;format=png&amp;auto=webp&amp;s=4b7a529c3fe846d0a3ff52b5e428bd84078e78b0

Hi!

I got tickets for seawheeze and I am so excited! It's my first half marathon! 

I am doing a rough planning of our trip to see how long we want to stay in Vancouver and I was curious if anyone who's previously attended could give some insight on these events.

For the Showcase Store, I heard previously that people lined up outside DAYS before to get in. Not that I plan to do that because I don't have the patience but is it possible to just walk in the day of to buy stuff or will it really sell out that early?

What is the PreWheeze party? Will it really be a spend all day kind of thing? Or just drop in take a lap and head out?

And for the SeaWheeze sunset festival I know John Summit is headlining. Is it just a rave or will it be workouts as well? Do people dress in athletic wear as well or actual regular clothes?

Thanks for the info!",https://www.reddit.com/r/lululemon/comments/1r6d09s/seawheeze_pre_and_post_race_events/
first orange theory!,60,"I’m a dedicated mat Pilates girlie but there’s none even remotely affordable near my parents house 😭it’s so much cheaper where I go to school so I’m trying orange theory instead while I’m on rotations here for a couple weeks. Top is from vuori size small (dynamic tank in surf I believe) and leggings are mystic aligns, size 4! ",https://www.reddit.com/gallery/1r6c8j0
I ❤️ the Jersey Training T-Shirts,70,"About a year ago I discovered the Jersey Training T-Shirt purchasing my first ever one via Poshmark (BNWT bargain!).

  

Since then I have been absolutely hooked and as I returned to the UK have been disappointed with the lack of colours being dropped whilst I see the US gets such nice vibrant colours. 

  

❤️ why I love it ❤️ 

\- the material is lightweight and flowy, and although I have wide hips it sits rather nicely whilst giving my chest/ stomach area some space

\- the length of it covers my bum, I don’t like working out in short length tees and prefer modesty giving me confidence of no accidental exposure

\- durability is amazing I wash these without care in the washing machine and tumble dry them and they’re still in excellent condition

  

I honestly wish I had managed to get the more vibrant colours and there’s definitely some on my list to get as I like monotone fits of complete sets. 

  

I highly recommend this tshirt to those looking for something that fits the aforementioned reasons why I love it.

  

🕵️ now excuse me as I try and hunt down more colours to buy 

  

  ",https://i.redd.it/oy53xoh6dvjg1.jpeg
Still Loving Indochine Blue!,212,Indochine Blue WTs (8) Define Jacket (8) Indochine Blue/Rainbow Lurex Cropped swiftly tee (10),https://www.reddit.com/gallery/1r6aivy
Lululemon hawaiian blue,35,I got this lululemon define jacket in Hawaiian blue last year but didn’t get matching shorts or leggings. Now im interested in getting matching shorts or leggings however they no longer carry this colour at lulu so I was just wondering if anyone knew of any brands that carry shorts or leggings in a colour identical to hawaiian blue. Can anyone confirm or deny if the dfyne colour “glacier” or aritzias “splash blue” is identical to Hawaiian blue?,https://i.redd.it/5te34tqisujg1.jpeg
Weekly Simple Questions and Advice Thread,2,"Have a simple question that isn’t enough to warrant its own post? Now you have a place to ask it!

If you are new to the sub, please read through our [FAQs](https://www.reddit.com/r/lululemon/wiki/faq/) as they address a lot of our commonly asked questions, such as ""when will \[item\] restock?"" and so much more!

ID and authentication requests are allowed in this thread only. Before posting, please read through this guide on [how to read a size dot](https://www.reddit.com/r/lululemon/comments/1jrkgx3/how_to_identify_a_style_name_color_or_size_of_an/) using Lulufanatics. If you're not able to identify your item via the size dot or your item does not have a size dot, you can post a photo of your item here by clicking the ""add image"" button in the bottom left corner when writing a comment. This is meant to be a spot for sub members looking to ID their own items, not resellers looking to get IDs on multiple pieces.",https://www.reddit.com/r/lululemon/comments/1r65omb/weekly_simple_questions_and_advice_thread/
Red Team Canada Shoes?,8,"Was looking through the Team Canada collection and noticed the model wearing these red sneakers, but couldn’t seem to find them for purchase on the app or website. Are these yet to be released? Thanks!",https://i.redd.it/0zqh86kwosjg1.jpeg
I have been wearing the wrong size all these years,241,"I have been wearing align leggings size 2 since 2022/2023 and while the fit was ok it did feel a bit tight around my belly and i thought it was normal.

Last week I decided to try another size - size 6 in align based on the model’s fit and I couldn’t believe how comfortable and better I feel.

At the same time I felt a bit stupid for letting this happen all these years. I have piles of leggings in all color assortment in size 2 and I wish I had known better!",https://www.reddit.com/r/lululemon/comments/1r61d44/i_have_been_wearing_the_wrong_size_all_these_years/
serene blue v sheer blue,4,does anyone have any color comparisons? i rly rly want the serene blue jacket but i can’t find any resellers so i’m thinking of settling w the sheer blue ,https://www.reddit.com/r/lululemon/comments/1r60qgq/serene_blue_v_sheer_blue/
ABC Pants Button Black Came Off,0,"The black has comes of the button on two pairs now. I wash on cool and tumble dry low. This is very frustrating given the price. Gas this been happening to anyone else?

ABC Pants Men’s casual. Side note Btw the 2nd pair i reordered feel 10x cheaper material than the ones i got 3 years ago. ",https://i.redd.it/kzjw9w40isjg1.jpeg
Mod Reminder: Using our sub to solicit money in exchange for photos is prohibited,183,"Hi everyone,

We have been made aware that multiple members of our community have been posting photos of themselves here and/or writing specific bios in order to find buyers who will send them money in exchange for additional photos.

We want to be very clear that using this sub to sell content (in DMs or otherwise) is strictly prohibited and the users involved have been permanently banned.

If you ever encounter users who are doing so, please report them to mods immediately so we can take action. Thank you for keeping this sub a safe space for everyone.",https://www.reddit.com/r/lululemon/comments/1r60fj9/mod_reminder_using_our_sub_to_solicit_money_in/
Bra Help for a 34DDD,4,"I am hoping someone could vouch for at least two of these! I'm about 155lbs, 5'3 with 34DDD/ 36 DD. Usually wear a size 10 in bottoms but I haven't bought a Lulu bra in years. I am currently big into Pilates and weightlifting. I have other bras from other brands for high-impact such as running, so I am wondering if any of these + sizes would be ideal for me for more low-impact days. Or do these run fairly small? I read the reviews but would love some input on here!

Thank you!",https://i.redd.it/5evc7a0zyrjg1.png
How has a company this big not figured out relative demands for different sizes??,303,"God forbid a girl size 4-8 ever wants a sale item (especially any form of aligns). In fact, I can go kick rocks while I’m at it. 

It’s always the smallest xxs, 0 sizes that sit around being the only ones in stock in wmtm. It blows my mind that they seemingly haven’t even attempted to analyze their sales like this. Seemingly, this constant failure hurts them and the customer, right? Why haven’t they adjusted their inventory?",https://www.reddit.com/gallery/1r5wpaq
Nulu Racerback Bralette,12,"I love the stripes so much! Has anyone gotten this new bralette? There are no reviews online yet, and only a few posts on tik tok but no try ons. I live 3+ hours from the closest store so unfortunately I can’t see it IRL unless I order. To note, I have a small bust and need (at best) minimal support. ",https://i.redd.it/4mjswy31grjg1.jpeg
Groove No Line Heart (came damaged),9,"I have been waiting for the Groove No Line Heart Flares to be back in a size 4 because I was too slow to get the first drop! Best feeling! But when they arrived today I noticed they have a pen mark on the leg. It is not super noticeable but I still can’t help to be bothered a bit as they are pretty pricey. They also have a weird odor…. I assume they were originally a return.

Should I just return them? They are cute but I don’t even know if I really need them and now I’m just so bothered by the pen mark. I tried to reach out online but the Educator I got was very unhelpful and didn’t care one bit. In the past I have gotten a damaged item and was at least offered a $30 GC . ",https://i.redd.it/bryk5cw9erjg1.jpeg
Hit the Jackpot on marketplace 😍,70,"I scored these two basically brand new align top/bra from facebook 35 $yesterday and I absolutely love them ! 😍 honestly align tops and sports bras are my favourite to workout in. Super happy and I wanted to share 

🤍Align v neck tank top

🩷Align V neck bra ",https://www.reddit.com/gallery/1r5u0v6
Dark Red Birthday/Valentine’s Day Fit,19,"I turned 57 on Friday the 13th… no harm came to me! 

Dark Red Aligns (8) 28” 

Valentine’s Day appropriate! 
Cheers everyone. 
",https://www.reddit.com/gallery/1r5pokt
Loving my heart leggings 🖤,64,"jersey training shirt in burgundy bay, scuba oversized collegiate jacket in black, heart leggings in black, daily essential quarter socks, city verse sneaker in black",https://i.redd.it/witaqkv7cpjg1.jpeg
second hand find!!,72,"Today is my birthday and this incredible second hand find came in the mail today! the define jacket with the OG vent. The size dot just has a size and no number to look up so I think it’s that old. I usually prefer cropped ones but the deal on this was too good to miss out haha. Bottoms are softsteme bone, top is nulu ribbed in blue twill!  

PS I wish Lulu did birthday promotions! I would wanna stop my today but I don’t think they do any promotions rip ",https://www.reddit.com/gallery/1r5lqbj
galentine’s 💕♥️,152,had a galentine’s sweat date this morning! wearing the ribbed scoopneck bra in candy cloud and align 25” in raspberry coulis.,https://i.redd.it/5xj8k83itojg1.jpeg
Unrestricted Power - Is Slim Fit Back?,64,"After the recent trend of loose cuts in the men’s line, the Repper shirts -- and now Unrestricted Power -- feels like a reintroduced of slimmer fits. Both are labeled as ""tight"", but on me they fit more like true slim fits: form-fitting without feeling restrictive.

I tried the new long sleeve Unrestrictive Power for yoga and was impressed. The fabric is silky-soft, lightweight, and very stretchy.. meaning great range of motion without constant adjustments. I’ll probably use this more for yoga and running than lifting. It feels a bit too thin for abrasive work, and the price is… up there.

Wearing the Unrestricted Power LS (L) with one of my favorite Align colors - Black Plum (10).",https://i.redd.it/chicjzoeeojg1.jpeg
Rulu Drapey Oversized Yoga Jogger,57,"ANOTHER AMAZING PANT BY LULULEMON 🧞‍♀️🏺 I LOVE these pants so much. Perfect for yoga 🧘‍♀️ everyday wear or even to layer since they are oversized. Im PRAYING they don’t shrink but im 5’7 and the length is perfect. I may need every color! The Drapey look is so comfy.

I’m wearing black in size L",https://i.redd.it/tq10ph5ocojg1.jpeg
Lululemon Set,126,Oxford red aligns and wunder train sports bra :) ,https://www.reddit.com/gallery/1r5gsga
Pink Tide 🩷🌊,184,,https://i.redd.it/0s88wtt97ojg1.jpeg
"I spent $2,394 in 4 years, 8 months on Lululemon",113,This amount surprises me. I don’t feel like I have a ton of Lululemon clothes for the amount I’ve spent lol. How much do you spend on Lululemon annually?,https://www.reddit.com/r/lululemon/comments/1r5fagy/i_spent_2394_in_4_years_8_months_on_lululemon/
