title,score,text,url
new relaxed swiftly,3,relaxed long sleeved swiftly have been my go to to wear under my scrubs tops for years. they have redesigned and they’re awful.huge. boxy. weird length. the material seems different. i’m heartbroken. any suggestions on a substitute?,https://www.reddit.com/r/lululemon/comments/1rhod77/new_relaxed_swiftly/
Does this sweatshirt fit me?,10,"Got gifted this oversized scuba half zip hoodie size M/L and I typically wear a L/XL. Keep or sell?! I think it’s super cute but am insecure about wearing stuff that looks too small (I recently lost weight and have some trouble telling what size I really am) Thanks in advance for any help! 

ps ignore my paint job i’m picking colors! ",https://www.reddit.com/gallery/1rhlvf5
Lulu thrift store haul 28/2/26,26,"Scuba Oversized Full-Zip Hoodie (Army Green, XS/S)

Wundermost Ultra-Soft Nulu Crewneck Cropped T-Shirt (Glaze Pink, XS)

Align Tank (Storm Teal, 2)",https://i.redd.it/87n7jhh7ecmg1.jpeg
Mahogany Muse In Person,9,"I really appreciate when people post real pictures of their items because it really helps me make a decision whether I like the color. I think most of us know some of the Softstreme colors are different in person so I thought I would post these new wide legs I got in “Mahogany Muse.” They are definitely much lighter in person than what they show online, but I have to say I really like them…they are a really nice neutral, particularly for work which is mainly what I purchased them for. I was really disappointed in the light ivory as it showed every little skin imperfection on my behind.",https://www.reddit.com/gallery/1rhkmbx
Loose threads on a brand new pair of pants,0,"The threads are coming loose on the seam of a replacement pair of Align Mini Flares that I haven’t even taken the tags off yet. This is beyond frustrating because a brand-new pair of pants from Lululemon shouldn’t look like this. My concern is that it’s only going to get worse once I actually start wearing them. Should I just cut the loose threads off and call it a day, or go back again and get another replacement? Am I being dramatic, or is this as annoying as I think it is?",https://www.reddit.com/gallery/1rhki1j
Anyone have this tie dye align top and find it runs smaller than the others?,1,"Both of these are a size 10. I have about 15 align tanks and they all fit the same except this one. I double checked and the size dot says 10. Wondering if something is just wrong with this one or if all of these run small. Its a favorite and i barely wear since its too tight. Wondering if i should try to find in a 12 if it just runs small or if mine is just off
Tyia!",https://i.redd.it/v43qup06mbmg1.jpeg
"Align Tank is not for large chesticles, mistakes were made",90,"First time posting a picture, super self conscious 🥺 I couldn’t resist the WMTM price for both the wunder train with pockets and the align tank in grape mist.. today was the first time I matched them with the  black plum define jacket… and I literally couldn’t go out in public with the jacket unzipped… I couldn’t visit my MIL with the jacket unzipped.  We need the align tank in larger cup sizes… all 3 are size 14",https://i.redd.it/4squ36v9ebmg1.jpeg
Bowler Bag Question,11,"Hey! I recently got the Bowler Bag and trying to decide if I should keep it, exchange for a darker color, or return it. But when I checked the website, the product page is completely gone and it doesn’t come up at all. Seems a bit weird?

And if you own it, what are your thoughts? Worth keeping or not? Would love some honest opinions!",https://i.redd.it/t80qtqhidbmg1.jpeg
Do you think LLL is still good? Or at this point should I stick to dupes?,0,body text I guess? What do you think? I still love my pace breaker pants I think that’s the only good thing left from the men’s section. T shirts have always been shitty but sadly they’re worse nowadays. Socks are amazing still. The bags? Well they’re decent. I’ve never bought dupes before so I don’t know if I’m missing something or if LLL is fooling us with their three digit prices… ,https://www.reddit.com/r/lululemon/comments/1rhfxid/do_you_think_lll_is_still_good_or_at_this_point/
Utility Blue vs Steel Blue,1,Does anyone have a side-by-side of both colors? I couldn’t find anything online. Thanks!,https://www.reddit.com/r/lululemon/comments/1rhfkho/utility_blue_vs_steel_blue/
payment didn’t go through,0,"Hello , have anyone experience this I been a Lululemon pinnacle for At least a year now using my Amex card to do online purchases through the app , today suddenly I couldn’t make any purchases anymore I contacted a educator they told me it because the billing address is not in sync with your institution provider….. I called Amex after that they told me the payment went through it just the merchant blocked it they don’t know why ……..

Has anyone experience this before? ",https://www.reddit.com/r/lululemon/comments/1rhed5t/payment_didnt_go_through/
New cheetah print is perfect!!!,501,So obsessed! I think they might release a grey color as well !!!! &lt;3,https://www.reddit.com/gallery/1rhdh18
Align legging quality decline?,10,"I just received a new pair of align leggings in the mail in color Walnut Creek and was very excited to try them on. These are normally my favorite pairs of leggings that I wear every day. The first thing I noticed when I put them on is that the fabric felt thinner and not as buttery as they normally do. I have two pairs I bought in the fall (one is the blue pictured) they feel thick and buttery, but a few months later this new color feels much lower quality. Has anyone else noticed this? Do they just need a couple of washes? I thought about messaging the company but not sure what they could even do. ",https://www.reddit.com/gallery/1rhc98q
New Lulu haul,34,Define Jacket Nulu in Black Plum/Gold with Wundermost Ultra-Soft Nulu Square Neck Long Sleeve in Coconut Ivory with Align No Line HighRise Pant 28” in Black,https://www.reddit.com/gallery/1rhc979
monochrome??,288,"how do we feel about monochrome? is it cute, or a fashion faux pas? 

the shorts and belt are the fast and free line in storm teal. swiftly colors in order of appearance: sparkly storm teal/harmony, storm teal, sonic teal (?), maldives green, and wild mint. ",https://www.reddit.com/gallery/1rhbim6
Finally lost enough weight to wear her! 🎀,147,Forme jacket in Miami pink!,https://i.redd.it/mekw0gkgcamg1.jpeg
Saturday Neutrals!! 🤎🤍,103,"Absolutely loveeee these pieces!! Hope everyone has a fantastic Saturday and gets their training in ;)

Align pants 25” in French Press Sz 6

Wunder train Wide strap tank top in Ash Gray Sz 10

Define Jacket in Olive green Sz 8",https://www.reddit.com/gallery/1rhamrw
Bad quality for valentines print,69,I’m so sad. Probably should have known better than to get aligns with white on them:/,https://www.reddit.com/gallery/1rh7jqi
Psychedelic wash,92,"Psychedelic wash wunder train shorts + thrifted bra top - I’m thinking it may be citra lime? Paired with a thrifted athleta long sleeve to wear post run. My husband just told me these are his least favorite shorts, which is sad because they’re one of my most favorite 😂

I got a vein procedure done on my leg yesterday (3rd pic) - I wore goodnight plum pace rival shorts and a sheer oak brushed soft Steele half zip. I’m feeling so much better today and proud I was able to do an easy 5k!",https://www.reddit.com/gallery/1rh5cqv
Grey Onyx,31,Scored the Jersey training SHR shorts on WMTM the last week. I love the shorts but I feel the grey almost has a green hue and I don’t know what to pair with it? Even black looks off to me. What’re ya’ll wearing with this colour?? ,https://i.redd.it/s3tug34h49mg1.jpeg
What jacket is this ?,66,,https://i.redd.it/xy08g2ebr8mg1.jpeg
Saturday Rant and Unpopular Opinion Thread,0,"Don’t see you size in stock? The color you want hasn’t dropped? Package got lost or is taking forever to ship? Product not performing well? Can’t get through to GEC? This is the place to share your weekly Lululemon woes!

Please keep the rules (in particular, rules 1 and 3) and general reddiquette in mind when posting. This isn’t a spot to call out or harass specific users of this sub! 

Keep an eye out for a Sunday Raves thread tomorrow to share your good news for the week, too!",https://www.reddit.com/r/lululemon/comments/1rgytzv/saturday_rant_and_unpopular_opinion_thread/
Is the waterproof insulated cinch-waist parka warm enough for DC winters?,3,I’m looking to buy a parka or a puffer coat to keep me warm during the winters in DC. Is this warm enough and wind resistant? ,https://i.redd.it/t2j2obohe6mg1.jpeg
CS Backtracking on gift card compensation,113,"Since I just saw a post regarding OP receiving a gift card for just a product enquiry, I would like to share my recent distasteful experience with Lululemon. 

I received a wrong order and in the package contained the address, full name and email address of the intended customer. I only opened my package overseas (my bad, I know, but I never thought that I would receive a wrong order) after I left for a 2 month Asia work trip. 


Contacted CS and they refused to refund me the order I never received, until I return the wrong order. Well I couldn’t do the return overseas and offered to return to the stores of the 3 Asian countries that I’ll be visiting. We went back and forth for 2 damn hours. CS went away to escalate this case to his superiors and came back stating that they want my overseas address to arrange for an overseas return label. After I provided my overseas address, he then told me I can get a full refund instead. I was promised a $30 credit card compensation that will be credited in 1-2 working days. 

After the 2nd day, I reached out to CS regarding the missing promised gift card. They said they have processed and it’ll be credited in 1-2 working days. 

On the 4th day, I reached out again and they said the same thing. 

The following week, I received this email stating that I won’t be receiving the promised gift card. WTH? I sent a email and asked for an explanation. It has been 4 days since, and there is still no reply.


It’s absurd and bloody unprofessional. I decided this will be my last purchase with Lululemon. I am also spreading the word and asking the people around me to boycott Lululemon— for the prices that the products command, you would think you can receive better service quality. I am appalled, shocked and disgusted with the CS experience. It’s a blatant waste of my time to have to go through the lengthy process of getting a resolution. I also just sent a follow up, requesting CS for a respond.

Ugh.
",https://i.redd.it/v5pcehmcu5mg1.jpeg
Belt bags with metal buckle,1,Has anyone had any problems with their belt bag with metal buckles set off metal detectors? I really like the gold hardware on the bags and I think the metal will help the make it last longer (vs plastic zipper and buckle) but I don’t want any trouble. ,https://www.reddit.com/r/lululemon/comments/1rgs582/belt_bags_with_metal_buckle/
Does anyone know/understand why Wunder Under Smooth Cover was put out to pasture... again?,40,"Favorite style... and now it's gone... again...

Mods please don't take this post down- hoping to learn why this style was taken away... again... ",https://www.reddit.com/r/lululemon/comments/1rgr8yc/does_anyone_knowunderstand_why_wunder_under/
Pool Party inconsistencies between Lulu website and Like New???,25,"From L-R: Like new align top, Like new Flow y nulu, lulu website wunder 28” w/ pocket

ok I’m so confused… I bought some pool party wunders from lulu a couple months ago and recently bought a couple matching pool party top options from like new but the flow y nulu bra I got is a completely different color than the align top and the wunders… 

I looked up pool party on this subreddit and saw that there were some inconsistencies that had been discussed, but I was wondering if anyone else has any combination of these items and can verify that this is a “normal” inconsistency or if I just straight up got sent the wrong color. It’s even more confusing because the align tank and the wunders match perfectly and I got the off two different websites 😭",https://i.redd.it/tlcysb1xy4mg1.jpeg
EasyFive pants try on,63,"Unfortunately they only have the straight leg version in my size, for reference I usually wear a 2-4 (XXS-Xs) in lulu pants, I’m trying on a size 24 in EasyFive and find it still kinda lose (they are supposed to be a lose fit I think) To me they fit and feel exactly like a normal jeans, nothing so special about it, if it’s on sale I would buy, but I think I can find similar jean styles from other brands easily….has anyone tried on the flare yet?
",https://www.reddit.com/gallery/1rgn7vx
pink comparison 💗,42,,https://www.reddit.com/gallery/1rgkn5f
Smooth Fit Pull on pants/work trousers,1,"I have just discovered the Smooth Fit Pull on pants and I’m in love. Why they have stopped selling those ? 🥲

I bought them second hand, but can’t find any black pair 🥲

If you have any recommendations for similar pants (work appropriate, help define the booty, slim the belly and no bulge in the front) I’m all in! I have tried the Spanx Perfect pants but I don’t like them ",https://www.reddit.com/r/lululemon/comments/1rgj6n9/smooth_fit_pull_on_pantswork_trousers/
Customer service,36,Say what you will about declining product quality or inconsistent sizing but lululemon’s customer service is unmatched. Used the online chat function to ask product questions about inseam lengths and they followed up an hour later with a summary of our conversation and $30 gift card. What other company is doing this?!,https://i.redd.it/p57a1h84l3mg1.jpeg
Inconsistent sizing,14,I don’t know if anyone else has had this issue but it is frustrating. I will buy two of the same things but in different colors and they will fit like two different sizes. I bought the Wunder train Strappy bra in deep sea blue and in black ( both size 10 and both C/D cup) and the deep sea blue one fits like it’s a size smaller. This has happened to me other times also with other things from lulu too. ,https://www.reddit.com/r/lululemon/comments/1rgguuw/inconsistent_sizing/
Faulty daydrift can I return another country?,0,"Help! I bought a pair of daydrift a in Germany last week, I’m on the way back to New Zealand and the stitching is already broken. 😩😩😩 I’ve hardly worn them, only for two days 😭nz website says they can only accept returned from items in nz. What about faulty??? I’ve tried to message the chat and haven’t been able to connect. Any advice is appreciated please!! Thank you ",https://www.reddit.com/gallery/1rggblz
Lulu for Casual Friday,17,Rainforest Green Oversized Fullzip Hoodie,https://i.redd.it/x7pkn3i613mg1.jpeg
New Grand Standard Polo,13,"Maybe too late for Vegas weather but still enjoy and had to pick up, also normally I like the skinny fit but also had to grab the Zeroed in slim fit pants…. Just not so sure about the pants…. Welcome any feedback ",https://www.reddit.com/gallery/1rge7hu
A few outfits I liked this week 🫠,188,"1. Softstreme quarter zip in Dramatic Magenta paired with Align™ High-Rise Short 6"" in Meadow Haze Pink Multi and Align V Neck Bra in Dahlia Mauve

2. Wunder Under leggings in Vintage Rose paired with Ribbed Nulu Asymmetrical Yoga Bra \*Light

Support, A/B Cup in Bone 

3. Wunder Train leggings in Grey Eucalyptus paired with Wunder Train Strappy Racer Bra in Grey Eucalyptus ",https://www.reddit.com/gallery/1rgciua
Size 6 or stay at 4?,3,"5'2"" 115 lbs 

waist: 26 in

natural waist: 29 in

hips: 35.5 in

thigh: 18.5 in (middle), 20 in (upper), 16 in (smallest)

sizing help? Aligns in 2 feel great. Wunder train HR size 4, the best fit. WunderUnder SmoothCover HR size 4, meh fit (loose skin/fat displacement)

I've gone through 2 pregnancies so I do have a tiny bit of loose skin that the wunderunder and wunder trains displace. I can't tell if it's a bad fit or just my new anatomy. Unfortunately we live too far from a store to go try on. Am i just not picking the right fabrics for my body? I've switching modalities from barre to strength training so need a few new pairs for that. 

The wunderunder give me a solid skin roll above the band during core exercises etc so I don't wear a tight fitting shirt with because it is not flattering. The wunder trains do not do that but are also very old and have been through a lot so could just be stretched out (I wore them  through a whole pregnancy) ",https://www.reddit.com/r/lululemon/comments/1rg8j8j/size_6_or_stay_at_4/
Purple haze 💜💗,173,Purple haze align size 4. Post yoga 🧘🏻‍♀️ ,https://i.redd.it/8mx3oe1yo1mg1.jpeg
Sizing help,0,"If I wear a size 14 in align top, 

What size should I buy in define nulu?

No store near me. Have to shop online

Thanks! ",https://www.reddit.com/r/lululemon/comments/1rg5xwl/sizing_help/
Friday Employment Thread,2,"This weekly thread is the place to get answers to all your questions about the interview process, questions commonly asked during interviews, and what it's like to be an educator. 

It's also a space for all our wonderful educators to share any inside scoops, hiring tips and tricks, and anything and everything in between! 

Happy Friday everyone! :)",https://www.reddit.com/r/lululemon/comments/1rg2o2f/friday_employment_thread/
Overnight re stock alert 🥳 WMTM Define Cropped Hooded Jacket Nulu in black https://shop.lululemon.com/en-ca/p/jackets-and-hoodies-jackets/Define-Cropped-Hooded-Jacket-Nulu-MD/_/prod11870684?color=0001&amp;sz=12,18,Almost full size run (🇨🇦) except for size 10 so far,https://i.redd.it/0o8xfgsqnzlg1.jpeg
"Chill, rainy day fit",53,Loungeful oversized jogger in slate brown. Oversized full zip scuba in olive brown,https://i.redd.it/0e9buqmfsxlg1.jpeg
Cruiser backpack review,20,"I’m usually never compelled to write a review, good or bad, for anything, but after 6 months of daily use, I have to say this might be the best backpack I’ve ever owned. The one caveat being is that it’s only been six months. 

After years and hundreds of dollars spent on finding a versatile every day backpack that looked decent, was durable and had a useful storage layout, I reluctantly, largely because of the price, I bought the cruiser as mostly a work/travel bag and so far I’m a huge fan. 

I’ve had very mixed results with the quality of Lululemon products but its been on a dozen flights crammed under seats and in storage bins, caught in the rain countless times and honestly treated like shit and I can’t see a single defect yet. Aside from my trail bag I’ve had for many years, it’s the first time in a while I’ve felt a bag might last. 

The storage options aren’t crazy, but for someone like me who travels or commutes with a laptop, a water bottle, toiletries/gadgets, and maybe a sweater or coat, it’s been perfect. 

I know I sound like some company shill but I would have saved myself hundreds of dollars worth of buying shitty bags and sadness if I just bought this in the first place, and feel like giving credit where credit is due. ",https://www.reddit.com/r/lululemon/comments/1rfs96h/cruiser_backpack_review/
regular define crop vs define mesh,4,hi everyone! does anyone know if they fit the same? i have the mesh one and wanting to get the indochine blue regular define cropped but they only have one size smaller so wondering if i can make it work or not. my local stores dont have either sizes in stock for me to try. tia!,https://www.reddit.com/r/lululemon/comments/1rfo2lh/regular_define_crop_vs_define_mesh/
Have you washed any of your bags in the washing machine?,4,"I’ve taken my bags in multiple flights are a personal item and would like to wash them, but afraid they may not survive a wash. Does anyone have any advice or experience washing any of your bags?

The bag I specifically have is the go getter bag.

Also, am looking into gettin the triple compartment tote ",https://www.reddit.com/r/lululemon/comments/1rfmuuy/have_you_washed_any_of_your_bags_in_the_washing/
Burgundy Bay Groove Wide Legs Back In Stock!!! (USA),18,"I have missed this every time and have been patiently waiting so I'm SO HAPPY I caught this. If you want these I would get them now, because who knows how long they will be in stock!",https://i.redd.it/37il1nnthwlg1.png
Pink shirt day (anti bullying day in 🇨🇦 💖),117,"I taught a block of classes yesterday on Canada’s anti-bullying day! I tried to get the LED lights as pink as possible 🤣🤣 

Ebb tank in pink pearl size 4

Align shorts size 4 black ",https://i.redd.it/or37sf4xgwlg1.jpeg
I want and need more nulu ribbed wrap tops! Gimme all the colors,47,"Today’s cross fit and I’m obsessed! Nulu ribbed wrap top in the pink color with the heart size large.  I cannot tell you got much I love this little cropped top! I got the black and the pink and want more more more!!! 

Ebb to street tank in black size 12 and my ever faithful wunder train black leggings. 

Hope you’re having an amazing day! ",https://i.redd.it/mqpiwmo97wlg1.jpeg
In store hem disappointment,14,I got my brilliant blue shorts hemmed to 6in and the hem came back looking cheap and feeling itchy. It looks like they used half the thread they should have because the stitches are so spaced out.... and I can feel the seam on my leg it's not soft like my factory leggings stitch. ,https://i.redd.it/ig37ayittvlg1.jpeg
Anyone else use their nano backpack as a wallet?,24,"I used to have the regular card wallet but this one is better imo! I can fit my keys and cash and cards, and coins in the little pocket!",https://i.redd.it/3tev2p1qrvlg1.jpeg
Bone and blue twill,83,"Wunder Unders blue twill and define jacket bone. Idk how to get the picture to not be a thumbnail! 

Anyway, I’m not usually a wear blue type of person, but I enjoy this combo! ",https://i.redd.it/qhnjg60fjvlg1.jpeg
Another awesome find.,110,Anyone else miss these kind of? When they were different and interesting. ,https://www.reddit.com/gallery/1rffrmy
Note to self: I need more Ashen Rose!☺️,93,"Heathered Ashen Rose align tank (8), Java WTs (8) and energy bra (10)",https://i.redd.it/7fk93tmgbvlg1.jpeg
Oxford Red Swift Speed High-Rise 25” (10),31,"The compression of these tights is unmatched! A big fan of Oxford Red, too! 

I forget the name of this Lulu shirt, but it’s also super soft. ",https://www.reddit.com/gallery/1rfeq1t
dusty lilac 😙,31,"a few fits from yesterday! not gonna lie the jacket doesn’t really go with the look but oh well 💀first fit is for a barre class! top is vuori, bottoms are align in Dusty lilac! jacket is heathered pink define. Second pic is dance studio straight legs for when I walk my pups  and last pic is a series top I saw at the outlets yesterday (that I did not end up getting lmao)",https://www.reddit.com/gallery/1rfbnfo
$21 price difference for pink pearl align tank,18," Does anybody know why the align tank in pink pearl is $21 more than every other color available? Instead of being priced the normal $68, it is $89. I wanted to order it but stopped when I added it to my cart, noticed something was off with my total and then saw the price. So weird. ",https://i.redd.it/m6ogy8wcfslg1.jpeg
Thursday WMTM Discussion,32,"Hi everyone! Hope you're all ready for what's hopefully an amazing WMTM drop today! Feel free to chat all things WMTM here! Is they're anything you're hoping to see turn up today? What are your thoughts on the drop? Did you end up buying anything? And more! 

**Since the drop happens early in the morning, please keep all WMTM links and discussion in the comments. Sort comments by new as the drop is happening to see any new WMTM releases.** 

**Tips and Tricks:**

* The new WMTM drop in the past has happened between 7-7:15 a.m. EST in the U.S and a bit later in Canada, but sometimes it can vary. Lately it's been earlier, between 3-5AM EST. 
* Best methods to find new items are to search the name of the item you're looking for in the search bar and using the edit in cart trick. Sorting by ""new"" on the WMTM page is laggy and not recommended.
   * Edit in cart trick: Add the item in any size or color to your cart and once it's in your cart edit it to pull up the color you want.
* If something isn't showing up for you when you click on the link, search by item/color name, open the link, delete everything after ""MD"" in the URL and refresh. you may need to do this a couple of times. if that doesn't work, try clearing cache and cookies and try again.
* The app is laggy, use the website.

Good luck all and happy shopping &lt;3",https://www.reddit.com/r/lululemon/comments/1rf3cj8/thursday_wmtm_discussion/
Burgundy bay for sunny SoCal weather,261,Define cropped and groove flare sz2. Weather is finally warm enough to wear these. ,https://www.reddit.com/gallery/1rezmdu
Lululemon email sweat collective,10,"Hi everyone, 

  
Has anyone else received this email today? 

https://preview.redd.it/08heafam0rlg1.png?width=933&amp;format=png&amp;auto=webp&amp;s=ad50aec16a1631499b98f1dc0cc750141ec04b25

  
",https://www.reddit.com/r/lululemon/comments/1rexpyd/lululemon_email_sweat_collective/
Help sizing Define Mesh,47,"first time poster! Can someone tell me if this is fitting or if I need to size up? Im not used to the cropped look so it looks either short or too small. This is the define jacket mesh in a size 6. I did try a size 8 in store and it looked loose in the back and where the boobs are, I’m smaller chested. I just ordered the 6 hoping it would fit better. I feel like I’m suppose to be a Lulu size 7.",https://www.reddit.com/gallery/1ret15b
