title,score,text,url
Scuba dilemma: heathered vs solid dark color (walnut crunch) + halfzip or fullzip?,3,"I’m deep in a Scuba decision spiral and could use some real-world input.

I’m choosing between heathered vs solid dark Scubas, specifically Walnut Crunch. I love how the solid dark looks, but I’m a little worried about visible fading over time since I plan to wear this a lot. Heathered seems more forgiving, but I’m not sure if it reads more casual or “older” compared to a solid.

I’m also deciding between the oversized half zip and the full zip. This will be my go-to for errands, gym, and travel (airports)

Would love thoughts from Scuba owners:

	•	Do heathered colors actually hide wear/fading better?

	•	How do solid dark Scubas age after frequent washing?

	•	Which do you find more versatile: half zip or full zip?

	•	Any regrets with either color or style?

Comfort + versatility are my top priorities. Appreciate any advice! tysm in advance!",https://www.reddit.com/r/lululemon/comments/1r13tq5/scuba_dilemma_heathered_vs_solid_dark_color/
Ivy Grove finally won me over on Defines,122,"I’ve had a few defines and I never like them, I actually gave away my last two a few months ago vowing I wouldn’t buy them again.

Yet here we are. I loved this colour with the gold zip and had never done the cropped version.

I’m keeping it 

Ivy grove define in cropped size 6

Glow up tights in graphite grey size 4",https://i.redd.it/vc0l154aeoig1.jpeg
"Love month fit ❤️‍🔥 Hot Heat Scuba — a bold red-orange with warm, fiery undertones — paired with my Heathered Black set for balance.",27,"Heathered Black: WT LL (8)

WT 25” (4)

Hot Heat : Os 1/2 zip hoodie (!XS/S)

Flare/Flare/ pink mist : Chargefeel low workout shoes ",https://www.reddit.com/gallery/1r11sqa
"Waiting room, throwing a fit",11,"inadvertently dressed in all lulu to take my husband in for an out-patient procedure. Honestly, this is a big reason I enjoy lulu. Incredibly versatile. 

adapted state high rise fleece joggers- atmospheric purple

men's license to train hoodie (small)- rainforest green 

classic ball cap-jeweled magenta

charm hair tie- black lol

simply effortless jacket- wheat yellow

not pictured but a necessary layer: wundertrain strappy tank- lip gloss",https://i.redd.it/ki9vbxws8oig1.jpeg
🤍Backstreet Boys 🤝🏻 Lululemon🤍,116,"Memories of a lifetime made with my best friend seeing BSB: Into The Millennium 🤍 

Thankful for the versatility of LLL since it contributed to half my outfit. The Iridescent EBB was PERFECT for this concert! 🦄  

EBB 1 L  |  Iridescent 

Dance Studio Relaxed-Fit MR Cargo Pant  |  White 

Happy 90’s Kid  |  Y2K Core ",https://www.reddit.com/gallery/1r10df9
"Palazzo (old style WMTM), size 12 if 8 &amp; 10 fit?",1,"I usually buy a size 8 and have several pairs, recently I grabbed a size 10 and feel literally no difference… now there is a retired color I want, but only in a 12, should I go for it?  Very little difference or too risky?",https://www.reddit.com/r/lululemon/comments/1r10cfg/palazzo_old_style_wmtm_size_12_if_8_10_fit/
Employment,52,Started as a seasonal job due to extra availability thought a break from my adult job would be nice. Absolutely not! The mean girl agenda is insane there is a literal clique who I’ve caught talking about me and alienate anybody I talk to. They didn’t know I was outside the door and was telling others “ she’s weird you need to stay away from her”. Sending my mental health through a spiral I never understood what I did wrong even asked higher ups how I’m doing and they just say fine no complaints. Not only ruin my experience but ruined my likes of the brand. Ended up ending contract early. ,https://www.reddit.com/r/lululemon/comments/1r1081k/employment/
"Burgundy Bay Thin-Strap Shelf Bra Maxi Dress, size M",57,"Asia design edition! This dress is so soft. It’s made from a thin ribbed modal material, and I appreciate that it has the built in bra. It also has a very nice lining that comes down to about 3 inches above the knee. I’m ~5’7” for reference. This dress is long!!!! But I really love it in this color. I’m looking forward to warmer days!
There are no pockets though! ",https://i.redd.it/2uwiouhbonig1.jpeg
Tuesday Drop Discussion,14,"Hi everyone! Welcome to the official **Tuesday Drop Discussion**! Chat here about your reactions to the new drop, what you're planning on buying (or not buying...), and anything and everything in between!

————————

**Please keep all links and discussion around the new drop in the comments. Sort comments by new as the drop is happening to see any new releases.** 

————————

**Tips and Tricks:**

\- If something isn't showing up for you, search by item/color name, open the link, delete everything after product name and refresh. You may need to do this a couple of times. If that doesn't work, try clearing cache and cookies and try again.

\- Edit in cart trick: Add the item you want in any size and color to your cart, and then once it's in your cart change it to color you want.

\- Don't look at the What's New page, use the site search bar.

\- The app is laggy, use the website.

\- The new drop has generally been starting around 2:10 p.m. EST in the U.S. and just after 3 p.m. EST in Canada, but sometimes (very infrequently) it varies.

\- USA and Canada pretty much always get the same new items, just as mentioned above, Canada's drop happens around 40 minutes later, thus there's no Canada thread.

Good luck and happy shopping! 🥰",https://www.reddit.com/r/lululemon/comments/1r0ws64/tuesday_drop_discussion/
The “jeans”,84,"Didn’t get a pic of the tag and regret it because I have no idea what these are called. They had 3 neutral colours… 

They are size 24” though and they are much bigger than a usual 24” pant, because I no longer fit 24” pants. I’m 5’3” around 105lbs. 

This was the smallest size (that I saw) and I’m usually a 4 so I don’t imagine the size 0/2 crowd are going to like how these fit. They felt stiff and too wide for me so it was an easy no. ",https://www.reddit.com/gallery/1r0udq6
Monday’s Fit 🌸🍷,63,"V-Day week so went with a couple of colors to match the themes color 💕 

28” Align leggings in Redwood I believe (dot W5AYNS) sz 6

Define in Pink Organza sz 10

Align Cami in Magenta Smoke sz 10",https://www.reddit.com/gallery/1r0sq47
Dahlia mauve + pink dragonfruit 🩷🌸,56,Dahlia mauve rest less pullover and pink dragonfruit dance studio joggers for day 1 of Valentine’s Day Spirit Week 💕🩷💘 This is sooo much pink but I’ll take any excuse to wear joggers and sneakers to work. So cozy all day!,https://i.redd.it/g8t34jdnzkig1.jpeg
Are ”define shorts” coming?!,61,"I haven’t seen these shorts before, are they a new “Define short?” No horizontal hip seam like the align and I love the vertical seam down the front! ",https://i.redd.it/jffhof58rkig1.jpeg
I love the waffles 🤌🏼🧇,49,"For our walk to the playground we have the Faint Lavender 🪻 waffle, Blush Quartz LAC and Wunder Trains in Willow Green (I just got these today and this might be my perfect green. I love them so much 🥹) EBB is Lavender Frost.

For my BOY FREE luxurious Sunday with Starbucks to visit the LLL store...Mink Berry waff set, American Eagle fleece lined tee and my LNYoftheRabbit EBB.

The day before we got our first foster and he's a major cutie.",https://www.reddit.com/gallery/1r0nddr
🤯 opinions?,22,"Grape mist / Nightfall — opened my package and thought I ordered the same leggings in a 2 and a 4 — went to a lighter room and realized nope! Just so similar. I don’t have a store near me, but I’m not sure I should keep both 😭 . Would there be any logic to keep both other than matching tops? ",https://www.reddit.com/gallery/1r0llsy
Sharpie went through the wash with my studio pants,18,Had a sharpie pen in a pocket with the load I put through the wash. The whole load looks like this. How can I get it out? Hairspray hasn’t worked since it’s permanent ink. I’m at the point where I am thinking I will have to fabric dye them black.,https://i.redd.it/b4v6ocf61kig1.jpeg
I love these older pieces. These wunder under leggings are just the right amount of softness and compression. The lower rise is nice too.,78,,https://www.reddit.com/gallery/1r0j9he
In 🤍 with the white silver define,74,,https://www.reddit.com/gallery/1r0j5bt
🥀🍷,207,"I had this burgundy bay fit since it released and it took me a while to want to wear it. 🥀🥀 

Personally not a fan of the these grooves no line. Too much stretch with no compression. So you have to wear the right underwear or have absolutely no fat on your body in order to get things to look smooth. 

But I decided to keep because I love the heart detail so much. 

Valentine Burgundy Bay top in medium

Grooves tight no line in 6

Second pic is in direct sun light 🥰",https://www.reddit.com/gallery/1r0ia55
Seawheeze 2026 draw,22,had anybody from the random group draw heard back yet? ,https://www.reddit.com/r/lululemon/comments/1r0i9u5/seawheeze_2026_draw/
petition to bring back ideal mint🩵,874,"energy bra size 6, align shorts 4” size 4, scuba oversized full zip size m/l all in the color ideal mint",https://www.reddit.com/gallery/1r0i022
outlet finds that were not to be (from last week),19,"Apologies for the mid quality photos, wasn't planning on making a post at the time!

In photo order:

1. **tidewater teal align crop 21""**: not my size and the length is too cropped for my height, but loved the color!
2. **speed up short \*sw, 2.5""**: if low-rise things weren't such a travesty on me, I would've left with these. loooooved the pattern so much 😭😭😭 went home and looked up the color (erbw/blk), then belatedly realized the \*sw on the tag meant SeaWheeze. didn't even  notice the SW logo on the shorts themselves until I looked back at dressing room pics. these probably have been bought since, but if not I hope they'll be snapped up by someone heading to SeaWheeze ✨  also these are from 2018!
3. **white align shorts 6""**: for the low, low price of... $64 (no category sales on shorts that day), amused seeing the markdown sticker next to the retail price 😂
4. **charged indigo cargo SHR hiking tight 25""**: absolutely not my size but caught my eye; thought these looked very Outdoor Voices/functional, intriguing to see in person
5. **tidewater teal fast &amp; frees 25"" 5 pocket**: unfortunately too big but again, THAT COLOR! it pained me to pass these up as all of the fast &amp; free 5 pocket tights were in a category sale for $49 😔 none of the colors in my size appealed to me
6. bonus fit pic, 1 of 3 items I actually purchased: **black plum align joggers** (28"", sz 8). OMG never knew what I was missing here! whenever I saw the model photos for align joggers online I thought they looked awful; finally tried on and instantly loved them. was also thrilled to add another black plum item to my wardrobe, cannot get enough of this color 💜",https://www.reddit.com/gallery/1r0gj7f
Brand New Sentence From GEC,144,"The outsourced people/bots they have working for GEC live chat is exceptionally awful.

Their second reply is a sentence that insists upon itself? JK it just makes less sense the more you read it.",https://i.redd.it/5jebih2k2jig1.jpeg
Help influence and deinfluence me!,9,"I basically have no workout clothes and have been actively going 5 days a week to either yoga, strength training or playing squash. 

Is there anything I should add or remove? Happy to hear any advice or suggestions 🫣

Also any size suggestions are helpful!! ",https://www.reddit.com/gallery/1r0f71k
Align Sizing Help,1,"Hello, 

I’m looking for advice on which size aligns to pick. Based on the size chart my hips are a 0 (30”) and my waist is a 2 (23.5”). When I try on in store the 0 looks better on, but feels a bit tight around my stomach. The 2 feels better on my torso, but there’s baggy fabric around the crotch. Should I go with the zero and hope they stretch? I think the 2s are too baggy to look good on.",https://www.reddit.com/r/lululemon/comments/1r0e7tl/align_sizing_help/
Grey Monday- featuring Coal,9,"My typical work/workout from home fit…

No Line Aligns, 28” in Coal

Vuori Strato Tech shirt in Charcoal Heather",https://www.reddit.com/gallery/1r0dnyp
Pink Pearl and Strawberry Milkshake,113,"Here is a comparison between Pink Pearl and Strawberry Milkshake. They’re the same, but I think Pink Pearl uses a lighter thread than Strawberry Milkshake.

I will recommend this color if you don’t have STMI yet. Same color, but cheaper than what’s in online marketplaces right now 🍓

I bought these because the leggings size I bought is a better fit, and I like the rose gold accent in the jacket 🫣

First photo

Top PIAR, STMI

Bottom STMI, PIAR

Second photo onwards 

Left STMI

Right PIAR",https://www.reddit.com/gallery/1r0b3vg
Walnut crunch and herringbone!,89,"Love this combo!!!

Walnut crunch wide leg groove (my new fav) 10

Herringbone nutmeg cropped define 8

Ashen rose bra there too! ",https://www.reddit.com/gallery/1r09yvo
Black plum is awesome,30,So rare that I would reach for plum/wine colored leggings but friends here inspired me to try a pair. Got black plum aligns on MD and paired it with a waffle hoodie in black. A bit harder too see in my rather dull interior lighting but I can assure you that it goes with so many different colors. ,https://i.redd.it/q8l7zas13iig1.jpeg
"Post run selfie, ft. my dog’s judgement energy. Even she’s like “okay but why?”",118,"WT Strappy bra in Sour Grape 🍇 

Speed Up Shorts in maybe Moonlit Magenta? They were a $10 thrift store find and LL Fanatics wasn’t too friendly with the search so if you know drop it in the comments  

It’s feeling like summer again in Texas ☀️",https://www.reddit.com/gallery/1r0931o
Advice for LaC B/C or D/DD,2,"I'm a 34C looking for some advice on which size of Like a Cloud bra to choose. I typically like bras with wider shoulder straps and I've read many good things about LaC. But the B/C cup LaC is thin shoulder straps and the D/DD one is wide straps. 

Wondering: 

\- what exactly is the difference between the two aside from the strap? 

\- if I get the D/DD, would I still be getting the size I normally get (8)? 

\- any comments on normal vs ribbed vs dot? 

Thanks :) ",https://www.reddit.com/r/lululemon/comments/1r08in6/advice_for_lac_bc_or_ddd/
Goodbye to a favourite,14,"The elastic band of one of my favourite bras came off in the wash today.. it's lasted me many years (shout-out to quality control back in the day) and it's finally time to say goodbye 🥲 It was really flattering for my A chest, the mesh underboob made it so airy (living in a hot and humid country), and in such a pretty colour too.  

Anyone has/had this and love it too? Or know a good replacement? ",https://www.reddit.com/gallery/1r050n8
Wearing lululemon with jeans because nobody can stop me 😈,528,"This is the cropped define jacket in Serene Blue, by the way!",https://i.redd.it/3tqy8c5lvgig1.jpeg
Monday Pre-Drop Discussion Thread,14,"Hi everyone, hope you all had an amazing weekend! What better way to start to kick the week off than discussing what we're hoping to see released tomorrow? 

Here's the place to chat about all your pre-drop hopes, dreams, and grievances, and everything in between. Is there anything that's being rumoured to be released, have you spotted anything new in your local store? Please feel free to tell all!

Hope everyone has a great start to their week and hopefully Lulu rewards us with an amazing drop!",https://www.reddit.com/r/lululemon/comments/1r00aop/monday_predrop_discussion_thread/
Weekly Simple Questions and Advice Thread,1,"Have a simple question that isn’t enough to warrant its own post? Now you have a place to ask it!

If you are new to the sub, please read through our [FAQs](https://www.reddit.com/r/lululemon/wiki/faq/) as they address a lot of our commonly asked questions, such as ""when will \[item\] restock?"" and so much more!

ID and authentication requests are allowed in this thread only. Before posting, please read through this guide on [how to read a size dot](https://www.reddit.com/r/lululemon/comments/1jrkgx3/how_to_identify_a_style_name_color_or_size_of_an/) using Lulufanatics. If you're not able to identify your item via the size dot or your item does not have a size dot, you can post a photo of your item here by clicking the ""add image"" button in the bottom left corner when writing a comment. This is meant to be a spot for sub members looking to ID their own items, not resellers looking to get IDs on multiple pieces.",https://www.reddit.com/r/lululemon/comments/1r00ao5/weekly_simple_questions_and_advice_thread/
Help Find this Color,33,"Hi all, I'm in North America and trying to locate the pink (front-most) color. I see Oxford red and black online. I'm guessing the third one is only available overseas but I'm having trouble identifying the color name. Any help would be appreciated!",https://i.redd.it/ajndto1jgfig1.jpeg
Sizing?,11,Curious if you like a loose fit or tight? Did you get a size down or your regular size? ,https://i.redd.it/437yx9rbweig1.jpeg
Lululemon in movies/TV,13,"So lately I've been binging on the show SWAT (the reboot of the 1970's show) and I noticed the guys have on Lululemon Metal vent shirts, in pro wrestling, Ronda Rousey wore Lululemon during her time in WWE, have y'all noticed any Lulu in shows/movies? ",https://www.reddit.com/r/lululemon/comments/1qzwg54/lululemon_in_moviestv/
Hacks for strap not staying at the length set,11,"I don't think it's only happening to me but for some of the smaller crossbody bags, the strap length goes to the very end even if I set it at a shorter length. what are you hacks/tips for this? thanks. ",https://i.redd.it/y0mcd7im5eig1.jpeg
Styling Tips?,8,"How does everyone style their colourful leggings for day to day? I love doing fun combos when I'm working out but don't feel confident enough to wear them out of the house! 

I have a pair of Aero blue leggings just collecting dust cause I don't know how to style them. 

Oxford Red has also been calling me but I don't know how I would wear the leggings day to day! 

I see so many people wearing them and am curious what are you go to outfits for more bold leggings ",https://www.reddit.com/r/lululemon/comments/1qzstgx/styling_tips/
Soniccccc 🩷,193,"Sonic pink 🩷💕

Tis the season to wear pink head to toe 

Aligns + energy long line",https://i.redd.it/elf8e9ld7dig1.jpeg
Dance studio pants?,15,"Hi all,

I bought two dance studio pants to wear as comfy pants for errands and I thought they were light enough for Florida summers. Now that I put them on after buying them, I’m thinking they look like scrubs/give scrubs energy. I need some honest and objective opinions. Do dance studio pants give off scrubs energy? ",https://www.reddit.com/r/lululemon/comments/1qzm505/dance_studio_pants/
Ruched Crossbody 6L Review?,8,I’m thinking of ordering this bag. It is the 6L. Does anyone have it? Thoughts? If you have any pictures of it I would love to see it! Is it stiff? Do you have a color preference? Thank you so much!!! ,https://i.redd.it/5k2x7cbd5cig1.jpeg
Align high rise twist tights in black,42,"Too short to be practical for the winter (which is very long and can get super cold) in the city where I live, but looks decent I think. 

For reference I’m between size 0-2 according to the size chart and I tried the 2. 0 was not available in store. ",https://www.reddit.com/gallery/1qzkbed
WMTM Haul 🩵🩷,92,"My full order from my recent WMTM haul arrived!

Note: Only thing I did not purchase from WMTM is the Energy bra in Walnut Crunch 🤎

From WMTM:

🩵 Energy Bra (Size 8) - Sinatra Blue

🩵 Align HR Shorts 4” (Size 8) - Sinatra Blue

💜 WT’s 25” (Size 8) - Dusty Lilac

🩷 License to Train Wide Headband - Blissful Pink

🩷 Daily Essential Crew Socks (M) - Blissful Pink

Sooooo excited to wear these pieces!",https://i.redd.it/3rpbvasqwbig1.jpeg
Heart Collection Review🖤❤️,64,"\*TLDR: Finally got in the store to try some heart items on! I will be waiting until they hit WMTM to purchase, like but don’t love. 

5’6” / 180 lbs / 30” waist / size 10 &amp; 12 for bras / size 6 for aligns / size 8 for wunder trains. 

Nulu Ribbed Cropped Tank Top \*Heart - Size Large - Burgundy Bay: it’s super cute, I’d prefer if it had a shelf bra. 

Groove No Line High Rise Flared Pant \*Heart - Size 6 - Burgundy Bay: material is really soft, but they are not compressive at all. I like but would buy in black if I purchased. 

Groove No Line High Rise Tight 25” \*Heart - Size 6 - Black: I like these because I would just wear them more being not flare. Back is flattering! 

Nulu Ribbed Wrap Front Long Sleeve Shirt \*Heart - Size Large - Black: I actually really like this top. It’s flattering and the details on it are cute. Can dress up or wear to yoga. Will definitely purchase in the future! ",https://www.reddit.com/gallery/1qzi1uc
Favourite funnel neck scuba colour?,2,"I recently fell in love with Lululemon oversized crop scubas, but only the funnel neck version - I wish they made a funnel variation for every colour! I've been scouring the resale markets for previous releases and want to know - what is your favourite colour that they've released as a funnel neck? ",https://www.reddit.com/r/lululemon/comments/1qzgz6k/favourite_funnel_neck_scuba_colour/
"Yes, the horses stay on during yoga 🐴",182,"A horse girl dreams come true 

Lunar New Year lululemon Align High-Rise Pant 25"" in Colour Lunar Plumes Chrome Multi

Align V Neck bra on Black ",https://www.reddit.com/gallery/1qzgkvx
Daisy Glow 🌼,39,"First time wearing this tank top for lifting (small). I know it’s not meant for this activity as the straps kept slipping, but other than that, it’s very comfortable.

I wish they’d make more yellow shades…and preferably not cropped! 🫠",https://i.redd.it/sfprxgub9big1.jpeg
Burgundy Bay Color Comparisons!,47,"https://preview.redd.it/5yhrrhge7aig1.jpg?width=960&amp;format=pjpg&amp;auto=webp&amp;s=dc7ae5a30d6bbf73fe20dd9d6399276d27e94d8a

IMO, Burgundy Bay is close enough to Garnet that if the Garnet tank wasn't too small for me now, I wouldn't have gotten the Burgundy Bay.

Edited to add- pictures were taken in 100% natural light.",https://www.reddit.com/r/lululemon/comments/1qza7n5/burgundy_bay_color_comparisons/
Cosmic leopard multi 🤝 rock wood,60,"Wunder train bra + 4 inch shorts - cosmic leopard multi 

Cropped half zip scuba hoodie - rock wood

I love this pattern! Trying to decide if I need them in full length wunder trains or just be happy with these shorts. 

Also, why do 4” tight shorts feel so much shorter than 2.5” pace crush/shake it out!? ",https://www.reddit.com/gallery/1qz8dp1
Sunday Rave Thread,3,"Finally found a restock on something you’ve been waiting for? Had an awesome experience in store? Tried out a new piece and you’re loving it? Let’s hear it!

This is the place for all the good things! Looking to vent instead? Check out Saturday’s rant thread.",https://www.reddit.com/r/lululemon/comments/1qz554r/sunday_rave_thread/
Herringbone came in . . .,135,,https://www.reddit.com/gallery/1qz2gk8
All Sizes Available!🖤❤️,59,"Nulu Ribbed Wrap Front Long Sleeve Shirt \*Heart

Black &amp; Burgundy Bay - All Sizes in stock!

https://shop.lululemon.com/p/nulu-ribbed-wrap-front-long-sleeve-shirt-heart/r89u26ekqd?color=72756&amp;sz=L&amp;skuId=158576180&amp;cid=pdp\_share\_header\_link\_icon",https://i.redd.it/q5wkowkco7ig1.jpeg
Yoga mat stained,5,"hey guys, I’ve had my new 5mm mat for all of one hour and all I did was test out one vinyasa into a child’s pose and I ended up with a forehead oil stain! NOTHING I have tried works. don’t tell me to use vinegar or baking soda because I shouldn’t have to do that but I tried and it’s still there. 

  
is this normal? I know I was warned about the lighter colors staining, but I got the dark purple ombré one and I genuinely had my forehead on it for a minute. I don’t even want to know the hell a hot yoga class will do to it. I’m debating if I should go in store and exchange for a black one or just go for a whole different mat company because frankly, this is silly. my tj max mat of 8 years never did this. ",https://www.reddit.com/r/lululemon/comments/1qyxq0z/yoga_mat_stained/
Rip tags,3,I am wondering if the rip tags are usually sewn in with additional stitching (same color as clothing) specifically for the tag? I gently ripped the tag out and some of the stitches where that tag was is loose. I can't tell if this is from the actual shirt or stitching for the tag itself.,https://www.reddit.com/r/lululemon/comments/1qyxiee/rip_tags/
abc regular jogger warpstreme useage,0,"I just bought these joggers and excited to wear them for travel, work, and on weekends. Has anyone worn them to the gym? They seem to fancy to be lifting? ",https://www.reddit.com/r/lululemon/comments/1qyvqcz/abc_regular_jogger_warpstreme_useage/
Help Is this too small?,101,I just got my first lulu piece ever in the magnolia pattern and it’s sooo beautiful but they didn’t have the size I was matched with so I sized down and it was on final sale so I’m scared it won’t be restocked and I’ve been getting mixed reviews from my friends/family about whether it’s too small. I did a quick workout test and it felt completely fine and didn’t move so idkkk anymore. Also I plan to go back into a deficit soon so idk if that changes anything just please be brutally honest!! ,https://www.reddit.com/gallery/1qyv40l
Tie Dye Scuba Set,18,,https://i.redd.it/4mxs96ps26ig1.jpeg
